{
  "schemaVersion": "dipole.agent.subscription-corpus-review.v1",
  "corpusSha256": "7b1c6f05065f356ef96954f40a7506afeea5bd721c587396c2b491e2a850a071",
  "minimumAgreementBps": 10000,
  "reviews": [
    {
      "reviewId": "review:guardian:one",
      "reviewerId": "reviewer:guardian:one",
      "labels": [
        {"caseId": "guardian.acknowledgement", "relevant": false},
        {"caseId": "guardian.commitment-deadline", "relevant": true},
        {"caseId": "guardian.decision-recorded", "relevant": true},
        {"caseId": "guardian.delivery-risk", "relevant": true},
        {"caseId": "guardian.file-upload", "relevant": false},
        {"caseId": "guardian.owner-missing", "relevant": true},
        {"caseId": "guardian.social-message", "relevant": false},
        {"caseId": "guardian.unrelated-group", "relevant": false}
      ]
    },
    {
      "reviewId": "review:guardian:two",
      "reviewerId": "reviewer:guardian:two",
      "labels": [
        {"caseId": "guardian.acknowledgement", "relevant": false},
        {"caseId": "guardian.commitment-deadline", "relevant": true},
        {"caseId": "guardian.decision-recorded", "relevant": true},
        {"caseId": "guardian.delivery-risk", "relevant": true},
        {"caseId": "guardian.file-upload", "relevant": false},
        {"caseId": "guardian.owner-missing", "relevant": true},
        {"caseId": "guardian.social-message", "relevant": false},
        {"caseId": "guardian.unrelated-group", "relevant": false}
      ]
    }
  ]
}
