{
  "schemaVersion": "dipole.agent.subscription-corpus-review.v1",
  "corpusSha256": "e3a0eb42bb6f40c6a81ff233fb468bb996452287d05b9b52b2908941605d3ab2",
  "minimumAgreementBps": 10000,
  "reviews": [
    {
      "reviewId": "review:alice:1",
      "reviewerId": "reviewer:alice",
      "labels": [
        {"caseId": "incident-positive", "relevant": true},
        {"caseId": "weekly-negative", "relevant": false}
      ]
    },
    {
      "reviewId": "review:bob:1",
      "reviewerId": "reviewer:bob",
      "labels": [
        {"caseId": "incident-positive", "relevant": true},
        {"caseId": "weekly-negative", "relevant": false}
      ]
    }
  ]
}
